{"schema_version":"1.0","world_run_id":"world-run-f1-example","tenant_id":"tenant-hctm","world_pack_key":"f1-contract-example","world_pack_version":"0.1.0","rules_version":"rules-0.1.0","branch_id":"main","timezone":"Asia/Shanghai","seed":"20260722","status":"paused","sim_time":"2026-07-08T10:00:00+08:00","created_at":"2026-07-22T04:00:00Z"}
